{
  "generated_at": "2026-07-03T11:39:09.956338+00:00",
  "run_id": "d988ed6cd64c",
  "summary": {
    "total_leads": 71,
    "hot_leads": 61,
    "warm_leads": 10,
    "contactable": 0,
    "with_whatsapp": 0,
    "with_phone": 0,
    "avg_score": 71.3,
    "avg_score_hot": 75.7,
    "conversion_probability": 85.9,
    "by_category": {
      "TRANSFER_PROBLEM": 31,
      "FINE_DISPUTE": 36,
      "DOCUMENTATION_ISSUE": 4
    },
    "by_platform": {
      "Reddit": 51,
      "Facebook": 20
    },
    "by_province": {
      "Buenos Aires": 5,
      "CABA": 2,
      "Entre Ríos": 1,
      "La Plata": 1
    }
  },
  "leads_hot": [
    {
      "id": "53e597580f44a3d7",
      "score": 100,
      "label": "real_lead",
      "problem_category": "TRANSFER_PROBLEM",
      "problem_summary": "Problema de transferencia",
      "persona": "(anónimo)",
      "provincia": "",
      "ciudad": "",
      "pais": "Unknown",
      "vehiculo": "moto",
      "patente": "",
      "fecha_visible": "",
      "fecha_iso": "",
      "platform": "Facebook",
      "source_url": "https://www.facebook.com/groups/190088371339305/posts/2713261042355346",
      "quoted_text": "Se puede transferir igual! Se realiza la transferencia a nivel registro y luego la parte municipal es aparte. Pero de poder se puede!",
      "contacto_publico": false,
      "whatsapp_publico": "",
      "whatsapp_link": "",
      "telefono_publico": "",
      "telefono_e164": "",
      "score_breakdown": {
        "multa_or_fotomulta": 60,
        "transfer_problem": 45
      },
      "detected_signals": [
        "multa_fotomulta",
        "transfer_problem"
      ],
      "discovery_timestamp": "2026-07-03T11:39:09.955049+00:00"
    },
    {
      "id": "c48113da7dd0ee5b",
      "score": 100,
      "label": "real_lead",
      "problem_category": "TRANSFER_PROBLEM",
      "problem_summary": "Problema de transferencia",
      "persona": "(anónimo)",
      "provincia": "",
      "ciudad": "",
      "pais": "Unknown",
      "vehiculo": "auto",
      "patente": "",
      "fecha_visible": "",
      "fecha_iso": "",
      "platform": "Facebook",
      "source_url": "https://www.facebook.com/Autofact.cl/videos/se-puede-comprar-un-veh%C3%ADculo-con-multas/2592614037430767",
      "quoted_text": "Comprar un auto con multas es posible, lo único que debes tener en cuenta es en qué etapa se encuentran tales multas a la hora de hacer la transferencia.",
      "contacto_publico": false,
      "whatsapp_publico": "",
      "whatsapp_link": "",
      "telefono_publico": "",
      "telefono_e164": "",
      "score_breakdown": {
        "multa_or_fotomulta": 60,
        "transfer_problem": 45
      },
      "detected_signals": [
        "multa_fotomulta",
        "transfer_problem"
      ],
      "discovery_timestamp": "2026-07-03T11:39:09.955032+00:00"
    },
    {
      "id": "60d3ee2e3cb1f43e",
      "score": 100,
      "label": "real_lead",
      "problem_category": "TRANSFER_PROBLEM",
      "problem_summary": "Problema de transferencia",
      "persona": "(anónimo)",
      "provincia": "",
      "ciudad": "",
      "pais": "Unknown",
      "vehiculo": "",
      "patente": "",
      "fecha_visible": "",
      "fecha_iso": "",
      "platform": "Facebook",
      "source_url": "https://www.facebook.com/SunarpOficial/posts/te-lleg%C3%B3-una-multa-por-un-veh%C3%ADculo-que-ya-no-tienes-esto-puede-pasar-si-la-trans/1370453925124599",
      "quoted_text": "¿Te llegó una multa por un vehículo que ya no tienes? Esto puede pasar si la transferencia vehicular no fue inscrita correctamente en Sunarp.",
      "contacto_publico": false,
      "whatsapp_publico": "",
      "whatsapp_link": "",
      "telefono_publico": "",
      "telefono_e164": "",
      "score_breakdown": {
        "multa_or_fotomulta": 60,
        "transfer_problem": 45
      },
      "detected_signals": [
        "multa_fotomulta",
        "transfer_problem"
      ],
      "discovery_timestamp": "2026-07-03T11:39:09.954967+00:00"
    },
    {
      "id": "46c928b68ac52442",
      "score": 100,
      "label": "real_lead",
      "problem_category": "TRANSFER_PROBLEM",
      "problem_summary": "Problema de transferencia",
      "persona": "(anónimo)",
      "provincia": "",
      "ciudad": "",
      "pais": "Unknown",
      "vehiculo": "auto",
      "patente": "",
      "fecha_visible": "",
      "fecha_iso": "",
      "platform": "Facebook",
      "source_url": "https://www.facebook.com/groups/276074287942602/posts/1263381515878536",
      "quoted_text": "La transferencia se puede realizar hay registros que te permiten optar si querés consultar patentes e infracciones y que no te exigen el ...",
      "contacto_publico": false,
      "whatsapp_publico": "",
      "whatsapp_link": "",
      "telefono_publico": "",
      "telefono_e164": "",
      "score_breakdown": {
        "multa_or_fotomulta": 60,
        "transfer_problem": 45
      },
      "detected_signals": [
        "multa_fotomulta",
        "transfer_problem"
      ],
      "discovery_timestamp": "2026-07-03T11:39:09.954947+00:00"
    },
    {
      "id": "58ea2a4819a5bf4d",
      "score": 100,
      "label": "real_lead",
      "problem_category": "TRANSFER_PROBLEM",
      "problem_summary": "Problema de transferencia",
      "persona": "(anónimo)",
      "provincia": "",
      "ciudad": "",
      "pais": "Unknown",
      "vehiculo": "auto",
      "patente": "",
      "fecha_visible": "",
      "fecha_iso": "",
      "platform": "Facebook",
      "source_url": "https://www.facebook.com/Autofact.cl/videos/-crees-que-no-puedes-transferir-un-auto-porque-tiene-documentos-vencidosla-reali/1552765283081960",
      "quoted_text": "✓ También es posible transferirlo si tiene multas anotadas o en proceso de anotación. Pero ojo ⚠️ ❌ No podrás transferirlo si tiene limitaciones ...",
      "contacto_publico": false,
      "whatsapp_publico": "",
      "whatsapp_link": "",
      "telefono_publico": "",
      "telefono_e164": "",
      "score_breakdown": {
        "multa_or_fotomulta": 60,
        "transfer_problem": 45
      },
      "detected_signals": [
        "multa_fotomulta",
        "transfer_problem"
      ],
      "discovery_timestamp": "2026-07-03T11:39:09.954928+00:00"
    },
    {
      "id": "f05fd2496bd936d0",
      "score": 100,
      "label": "real_lead",
      "problem_category": "TRANSFER_PROBLEM",
      "problem_summary": "Problema de transferencia",
      "persona": "(anónimo)",
      "provincia": "",
      "ciudad": "",
      "pais": "Unknown",
      "vehiculo": "auto",
      "patente": "",
      "fecha_visible": "",
      "fecha_iso": "",
      "platform": "Facebook",
      "source_url": "https://www.facebook.com/groups/276074287942602/posts/1247797814103573",
      "quoted_text": "⚠️ PUEDO TRANSFERIR UN VEHÍCULO CON MULTAS? Si bien algunas multas no son tan costosas pero hay otras que se vuelven imposibles de pagar ...",
      "contacto_publico": false,
      "whatsapp_publico": "",
      "whatsapp_link": "",
      "telefono_publico": "",
      "telefono_e164": "",
      "score_breakdown": {
        "multa_or_fotomulta": 60,
        "transfer_problem": 45
      },
      "detected_signals": [
        "multa_fotomulta",
        "transfer_problem"
      ],
      "discovery_timestamp": "2026-07-03T11:39:09.954904+00:00"
    },
    {
      "id": "44da8fb67e4c45d5",
      "score": 100,
      "label": "real_lead",
      "problem_category": "TRANSFER_PROBLEM",
      "problem_summary": "Problema de transferencia",
      "persona": "(anónimo)",
      "provincia": "",
      "ciudad": "",
      "pais": "Unknown",
      "vehiculo": "auto",
      "patente": "",
      "fecha_visible": "",
      "fecha_iso": "",
      "platform": "Facebook",
      "source_url": "https://www.facebook.com/groups/276074287942602/posts/1312257600990927",
      "quoted_text": "Hola se puede transferir un auto que debe patente y multa? O solo se inicia la transferencia pero queda observado? Auto 2006 municipalidad Lomas de Zamora. 0 ...",
      "contacto_publico": false,
      "whatsapp_publico": "",
      "whatsapp_link": "",
      "telefono_publico": "",
      "telefono_e164": "",
      "score_breakdown": {
        "multa_or_fotomulta": 60,
        "transfer_problem": 45
      },
      "detected_signals": [
        "multa_fotomulta",
        "transfer_problem"
      ],
      "discovery_timestamp": "2026-07-03T11:39:09.954641+00:00"
    },
    {
      "id": "86549dfdbf63acf6",
      "score": 100,
      "label": "real_lead",
      "problem_category": "TRANSFER_PROBLEM",
      "problem_summary": "Problema de transferencia",
      "persona": "(anónimo)",
      "provincia": "",
      "ciudad": "",
      "pais": "Unknown",
      "vehiculo": "",
      "patente": "",
      "fecha_visible": "",
      "fecha_iso": "",
      "platform": "Facebook",
      "source_url": "https://www.facebook.com/groups/276074287942602/posts/1319465576936796",
      "quoted_text": "Nadie puede negarte la transferencia ni la baja vehicular si no tenés multas asociadas a tu dni o patentes impagas. Eso es todo. 3w.",
      "contacto_publico": false,
      "whatsapp_publico": "",
      "whatsapp_link": "",
      "telefono_publico": "",
      "telefono_e164": "",
      "score_breakdown": {
        "multa_or_fotomulta": 60,
        "transfer_problem": 45
      },
      "detected_signals": [
        "multa_fotomulta",
        "transfer_problem"
      ],
      "discovery_timestamp": "2026-07-03T11:39:09.954622+00:00"
    },
    {
      "id": "2f6720fe535298ff",
      "score": 100,
      "label": "real_lead",
      "problem_category": "TRANSFER_PROBLEM",
      "problem_summary": "Problema de transferencia",
      "persona": "(anónimo)",
      "provincia": "La Plata",
      "ciudad": "La Plata",
      "pais": "Argentina",
      "vehiculo": "auto",
      "patente": "",
      "fecha_visible": "",
      "fecha_iso": "",
      "platform": "Reddit",